ID,Title,Authors,Abstract
2948388,Laparoscopy--a diagnostic aid in cases of suspected appendicitis. Its use in women of reproductive age.,"Spirtos NM, Eisenkop SM, Spirtos TW, Poliakin RI, Hibbard LT","1. Am J Obstet Gynecol. 1987 Jan;156(1):90-4. doi: 10.1016/0002-9378(87)90212-2.  Laparoscopy--a diagnostic aid in cases of suspected appendicitis. Its use in  women of reproductive age.  Spirtos NM, Eisenkop SM, Spirtos TW, Poliakin RI, Hibbard LT.  In women of reproductive age the usefulness of laparoscopy in diagnosing acute  appendicitis was evaluated. Eighty-six women underwent diagnostic laparoscopy.  There was complete visualization of the appendix in 93% of the patients.  Twenty-two patients were spared laparotomy. In the nonpregnant patients,  salpingitis was the disease most often confused with appendicitis. Eighty-five  percent of the patients with salpingitis had the onset of symptoms within 14  days of the last menstrual period, whereas acute appendicitis was found in 86%  of the patients with the onset of symptoms greater than 14 days after the last  menstrual period. The onset of symptoms relative to the first day of the last  menstrual period differed in these two groups of patients (p less than 0.01).  Patients who were spared unnecessary laparotomy had significantly diminished  hospital stays (p less than 0.001). Laparoscopy was found to be a safe and  effective way to diagnose acute appendicitis in women of reproductive age, and  its liberal use is recommended.  DOI: 10.1016/0002-9378(87)90212-2 PMID: 2948388 [Indexed for MEDLINE]"
4038908,Late infertile days in early postpartum cycles.,Hatherley LI,"1. Clin Reprod Fertil. 1985 Mar;3(1):73-80.  Late infertile days in early postpartum cycles.  Hatherley LI.  Luteal phase abnormalities in early menstrual cycles after pregnancy have been  shown to cause confusion in the practice of natural family planning (NFP) for  some patients and to restrict severely the number of late infertile days  available to others. The cause of the abnormalities is uncertain but appears to  be related to the nursing status of the patient.  PIP: Over a 6-year period, 1975-80, all patients who requested instruction in  the use of natural family planning (NFP) after pregnancy were offered the  opportunity of collating their family planning observations with the results of  urinary hormone assays. Participants were asked to record the basal body  temperature (BBT) each morning at the same time and at the same body site before  arising or imbibing fluid, hot or cold. At night, on retiring, patients were  asked to record the mucus signs experienced during the day. The observations  recorded were the basic patterns of dryness, of infertile or of fertile mucus,  and the transitions between patterns of mucus signs. It was recommended that  charts be commenced immediately on returning home after an abortion and within 3  or 4 weeks of term delivery. 24 hour urine collections were assayed for total  estrogen and pregnanediol excretion commencing on day 7 for postabortion  patients, at 4 weeks for nonlactating postpartum patients, and from 6 weeks for  nursing mothers. Participants also were asked to collect urine specimens  immediately before ovulation as predicted by the peak mucus sign and again 3-4  days after the temperature rise. The charted mucus signs and BBT observations  were examined analogically with the results of the urinary hormone assays and a  marginal line, separating the preovulatory from the higher postovulatory BBT,  was drawn at the completion of each cycle. Patients were free to remain in the  study for as long as they wished, that is, until they were confident that they  could practice NFP without further supervision or until planned or unplanned  pregnancies occurred. Postovulatory levels of total estrogen excretion greater  than the preovulatory peak values occurred in a number of participants. Luteal  phases longer than 16 days were found in 6 patients during the study period. A  short luteal phase was common in all groups, especially in the 1st  post-pregnancy cycle. The important finding was the wide scatter of preovulatory  estrogen excretion levels before the 1st postpartum ovualtion, especially in  lactating women, yet the mean levels of estrogen excretion were generally  greater in non-breastfeeding than in breastfeeding women. Abnormal BBT charts  were restricted to cycles with short luteal phases. The position of the marginal  line on the BBT charts was stable over the first 3 cycles in 106 of 197 (54%)  participants and inconstant in 91 (46%). No significant difference was found in  the incidence of constant or variable levels of the marginal line in the  successful and unsuccessful participants.  PMID: 4038908 [Indexed for MEDLINE]"
6861804,Combined partial temporal and secondary generalized status epilepticus. Report of a case with fear bouts followed by prolonged confusion.,"Zappoli R, Zaccara G, Rossi L, Arnetoli G, Amantini A","1. Eur Neurol. 1983;22(3):192-204. doi: 10.1159/000115559.  Combined partial temporal and secondary generalized status epilepticus. Report  of a case with fear bouts followed by prolonged confusion.  Zappoli R, Zaccara G, Rossi L, Arnetoli G, Amantini A.  A right-handed 32-year-old woman had recurrent combined partial temporal and  secondary generalized epileptic states almost constantly related to  menstruations. During such more or less prolonged episodes sometimes the patient  presented right adversive attacks with short postictal dysphasia. The catamenial  status epilepticus observed in this cas was manifested in two clear-cut  behavioral phases. The first phase was characterized by frequently recurrent  left temporal epileptiform discharges without tendency to diffusion,  progressively more prolonged and pseudorhythmic associated with a signalized  feeling of intense fear without apparent impairment of consciousness or speech  disturbances. The electroclinical features of the first phase suggest a depth  origin of the paroxysms, probably due to a primary epileptogenic focus in the  left amygdaloid-hippocampal complex. In the second phase the left temporal focal  semirhythmic discharges associated with fear bouts became more frequent and  prolonged and began to be followed by long-lasting generalized discharges  resulting in a trance-like state with severe impairment of consciousness. The  diffuse paroxysmal activity regularly preceded by the left temporal focal  discharges was interpreted as a form of secondary bilateral synchrony constantly  triggered from a focal pacemaker represented by the primary epileptogenic focus.  During the very short transient periods of sudden cessation of the epileptiform  activity the patient returned immediately to an apparent normal mental state.  Good correlation could be established between different seizure patterns and  predominant clinical signs. Intravenous diazepam rapidly decreased and then  completely stopped the catamenial status epilepticus. Some problems related to  the classification of these rare epileptic events are discussed.  DOI: 10.1159/000115559 PMID: 6861804 [Indexed for MEDLINE]"
7211780,Toxic shock in the teenage patient.,Weinberg HD,"1. Am J Dis Child. 1981 Mar;135(3):244-5. doi:  10.1001/archpedi.1981.02130270036012.  Toxic shock in the teenage patient.  Weinberg HD.  The toxic shock syndrome (TSS) is a newly described syndrome. It affects  predominantly teenage girls and young women at or around the time of their  menstrual period. There is fever, diarrhea, vomiting, and profound shock with  mental confusion, decreased renal function, and a scarlatiniform rash that later  desquamates. Rapid recognition and vigorous fluid therapy is essential. There is  a relationship of menses, Staphylococcus aureus, and the use of tampons in the  etiology of this new syndrome.  DOI: 10.1001/archpedi.1981.02130270036012 PMID: 7211780 [Indexed for MEDLINE]"
12338519,Errors in age reporting in Bengali populations.,"Edmonston B, Bairagi R","1. Rural Demogr. 1981;8(1):63-87.  Errors in age reporting in Bengali populations.  Edmonston B, Bairagi R.  PIP: Reports on the major errors found in age reporting on population censuses  and sample surveys among the Bengali speaking populations of what is now West  Bengal, India and Bangladesh from 1881 to the present, and identifies cautions  necessary in using Bengali age data. The problem of adjustment is not discussed.  Age reporting is confused by the use of 2 calendars, the western (Julian) and a  Bengali calendar in which the year begins in the middle of April. The Arabic  calendar is also used among Moslems. Moreover, birthdays are not especially  emphasized in Bengali culture. 4 types of age misstatement are examined:  preference for particular ages, for age groups, for age digits (as years ending  in 0 or 5), and the interaction of random error. The influence of the progress  of literacy on age reporting is also examined. Special problems with reporting  children's ages are noted. Underreporting of children 0-4 was found, both from  underenumeration and from a tendency to inflate ages. A slight tendency for age  preferences (especially ages 4 and 5) was found, and random error increased with  age up to 7 years. Digital preference becomes more manifest with adolescence and  early adulthood, 0 and 5 the most frequent digital endings. The effect becomes  more pronounced among people over 50. Problems with data grouped by 5 year  periods are thus intensified. Errors surrounding the age of majority seem  especially critical for females. A tendency is to deflate the ages of girls  until after menstruation and marriage, when their ages are adjusted to those  more suitable for married women. Young unmarried females are heaped at 10-12;  young marrieds at 15. Digital preference persists despite literacy improvement.  Single year age data may be improved by analytical approaches such as standard  smoothing techniques or developing alternative age groupings to minimize the  distortion, or by more careful and sensitive data collection techniques. Data on  5 year age groups are seen to have become marginally acceptable in recent  decades, showing some effect from improved literacy.  PMID: 12338519 [Indexed for MEDLINE]"
455978,Presence of elevated circulating levels of LH during the pre-menstrual period in some copper IUD users and the possibility of their confusion with hCG.,"Dattatreyamurty B, Joshi J, Mehta S, Virkar KD, Sheth AR","1. Contraception. 1979 Mar;19(3):213-21. doi: 10.1016/0010-7824(79)90015-5.  Presence of elevated circulating levels of LH during the pre-menstrual period in  some copper IUD users and the possibility of their confusion with hCG.  Dattatreyamurty B, Joshi J, Mehta S, Virkar KD, Sheth AR.  A heterologous radioimmunoassay (RIA) capable of discriminating between LH and  hCG was used to measure LH levels in sera obtained during the pre- and  post-menstrual periods from 80 women bearing copper intrauterine contraceptive  devices (IUD). hCG levels in these samples were also estimated by use of a  homologous beta-hCG radioimmunoassay and a radioligand-receptor assay. Only two  IUD users during the pre-menstrual period had detectable, but low hCG levels.  However, LH levels, as estimated by specific RIA, in the serum of these two  women were elevated to a level that would cause detection at low levels in the  hCG assays. The data thus provide direct evidence to indicate that the positive  hCG levels observed by others during the pre-menstrual period in some copper IUD  users could be due to the interference in hCG assays by elevated LH.  DOI: 10.1016/0010-7824(79)90015-5 PMID: 455978 [Indexed for MEDLINE]"
